{
  "id": "vocab.c1.21.05",
  "lesson": "c1-21-05",
  "title": "C1 Vocabulary — Nagy Lajos: Kiskunhalom & Deontic Labor Rights",
  "theme": "Labor Economics, Technological Displacement & Collective Bargaining",
  "words": [
    {
      "lemma": "napszámos sors",
      "translation": "day laborer's fate / lot",
      "pos": "expression"
    },
    {
      "lemma": "szociográfiai látlelet",
      "translation": "sociographical diagnostic / clinical diagnosis",
      "pos": "expression"
    },
    {
      "lemma": "kógens szabály",
      "translation": "mandatory / cogent rule (cannot be derogated)",
      "pos": "expression"
    },
    {
      "lemma": "elidegeníthetetlen jog",
      "translation": "inalienable right",
      "pos": "expression"
    },
    {
      "lemma": "agrárproletariátus",
      "translation": "agrarian proletariat",
      "pos": "noun"
    },
    {
      "lemma": "kizsákmányolás",
      "translation": "exploitation",
      "pos": "noun"
    },
    {
      "lemma": "kollektív alku",
      "translation": "collective bargaining",
      "pos": "noun"
    },
    {
      "lemma": "méltányos bér",
      "translation": "fair / living wage",
      "pos": "expression"
    }
  ]
}
