{
  "id": "vocab.b2.sporttortenet.04",
  "lesson": "b2-sporttortenet-04",
  "title": "Melbourne 1956: Triumph and Drama in the Pool Vocabulary",
  "theme": "Hungarian sports history and Olympic legacy",
  "words": [
    {
      "lemma": "elődöntő",
      "translation": "semi-final",
      "pos": "noun"
    },
    {
      "lemma": "felbőszít",
      "translation": "to enrage / infuriate",
      "pos": "verb"
    },
    {
      "lemma": "helytállás",
      "translation": "perseverance / standing one's ground",
      "pos": "noun"
    },
    {
      "lemma": "felülkerekedik",
      "translation": "to prevail / overcome",
      "pos": "verb"
    },
    {
      "lemma": "fegyelmezettség",
      "translation": "discipline",
      "pos": "noun"
    },
    {
      "lemma": "méltóság",
      "translation": "dignity",
      "pos": "noun"
    }
  ]
}
