{
  "id": "vocab.c1.biroifuggetlenseg.02",
  "lesson": "c1-biroifuggetlenseg-02",
  "title": "C1 Vocabulary — The Administrative Autocracy of the OBH",
  "theme": "The Dismantling of Independent Judiciary & Rule of Law Breakdown",
  "words": [
    {
      "lemma": "Országos Bírósági Hivatal",
      "translation": "National Office for the Judiciary (OBH)",
      "pos": "expression"
    },
    {
      "lemma": "hatalomkoncentráció",
      "translation": "concentration of administrative power",
      "pos": "noun"
    },
    {
      "lemma": "pályázat érvénytelenítése",
      "translation": "annulment of judicial appointment competitions",
      "pos": "expression"
    },
    {
      "lemma": "önkényes kinevezés",
      "translation": "arbitrary judicial appointment",
      "pos": "expression"
    },
    {
      "lemma": "fellebbviteli bíróság",
      "translation": "court of appeals",
      "pos": "expression"
    },
    {
      "lemma": "bírói önigazgatás",
      "translation": "judicial self-governance",
      "pos": "expression"
    },
    {
      "lemma": "hivatali visszaélés",
      "translation": "abuse of official power",
      "pos": "expression"
    },
    {
      "lemma": "kirendelés",
      "translation": "temporary judicial assignment / transfer",
      "pos": "noun"
    }
  ]
}
