{
  "id": "vocab.b2.10.02",
  "lesson": "b2-10-02",
  "title": "Who Performs the Action? Instrumental Agents (-val/-vel) Vocabulary",
  "theme": "Mentorship, discipline and intellectual growth",
  "words": [
    {
      "lemma": "témavezető",
      "translation": "thesis advisor / academic supervisor",
      "pos": "noun"
    },
    {
      "lemma": "tanítvány",
      "translation": "disciple / protégé / pupil",
      "pos": "noun"
    },
    {
      "lemma": "beszámoló",
      "translation": "report / account",
      "pos": "noun"
    },
    {
      "lemma": "felülvizsgál",
      "translation": "to review / to reassess",
      "pos": "verb"
    },
    {
      "lemma": "következetes",
      "translation": "consistent / rigorous",
      "pos": "adjective"
    }
  ]
}
