{
  "id": "vocab.b2.semmelweis.05",
  "lesson": "b2-semmelweis-05",
  "title": "Science, Ethics, and Public Trust Vocabulary",
  "theme": "Hungarian medical pioneers from Semmelweis to Karikó",
  "words": [
    {
      "lemma": "közbizalom",
      "translation": "public trust",
      "pos": "noun"
    },
    {
      "lemma": "tekintélyelvűség",
      "translation": "authoritarianism / reliance on authority",
      "pos": "noun"
    },
    {
      "lemma": "alázat",
      "translation": "humility",
      "pos": "noun"
    },
    {
      "lemma": "rövidlátás",
      "translation": "short-sightedness / myopia",
      "pos": "noun"
    },
    {
      "lemma": "fősodor",
      "translation": "mainstream",
      "pos": "noun"
    },
    {
      "lemma": "meg lehetett volna előzni",
      "translation": "could have been prevented",
      "pos": "expression"
    }
  ]
}
