{
  "id": "vocab.a2.235",
  "lesson": "a2-235",
  "title": "Lesson Vocabulary",
  "theme": "Holidays & celebrations",
  "words": [
    {
      "lemma": "meghívó",
      "translation": "invitation (card or message)",
      "pos": "noun"
    },
    {
      "lemma": "terít",
      "translation": "to lay the table",
      "pos": "verb"
    },
    {
      "lemma": "pezsgő",
      "translation": "sparkling wine",
      "pos": "noun"
    }
  ]
}
