{
  "id": "vocab.c1.alkotmanyjog.03",
  "lesson": "c1-alkotmanyjog-03",
  "title": "C1 Vocabulary — Emergency Governance by Decree & Proportional Correlatives",
  "theme": "Constitutional Breakdown: The Fundamental Law, Decrees & Institutional Capture",
  "words": [
    {
      "lemma": "veszélyhelyzet",
      "translation": "state of danger / emergency",
      "pos": "noun"
    },
    {
      "lemma": "rendeleti kormányzás",
      "translation": "governance by decree",
      "pos": "expression"
    },
    {
      "lemma": "felhatalmazási törvény",
      "translation": "enabling act",
      "pos": "expression"
    },
    {
      "lemma": "különleges jogrend",
      "translation": "special legal order",
      "pos": "expression"
    },
    {
      "lemma": "parlamenti kontroll hiánya",
      "translation": "lack of parliamentary scrutiny",
      "pos": "expression"
    },
    {
      "lemma": "törvény áttörése",
      "translation": "overriding / setting aside statute",
      "pos": "expression"
    },
    {
      "lemma": "jogbizonytalanság",
      "translation": "legal uncertainty",
      "pos": "noun"
    },
    {
      "lemma": "normális működés",
      "translation": "normal constitutional functioning",
      "pos": "expression"
    }
  ]
}
