{
  "id": "vocab.c1.26.03",
  "lesson": "c1-26-03",
  "title": "C1 Vocabulary — Adversative Rhetorical Refutation of Disinformation",
  "theme": "Media Ecology, Freedom of the Press & The Public Sphere",
  "words": [
    {
      "lemma": "cáfolat",
      "translation": "refutation / rebuttal",
      "pos": "noun"
    },
    {
      "lemma": "összeesküvés-elmélet",
      "translation": "conspiracy theory",
      "pos": "expression"
    },
    {
      "lemma": "ellenbizonyítás",
      "translation": "counter-evidence",
      "pos": "noun"
    },
    {
      "lemma": "álvalóság",
      "translation": "pseudo-reality",
      "pos": "noun"
    },
    {
      "lemma": "tudatos ködösítés",
      "translation": "deliberate obfuscation",
      "pos": "expression"
    },
    {
      "lemma": "ténybeli ellentmondás",
      "translation": "factual contradiction",
      "pos": "expression"
    },
    {
      "lemma": "helyreigazítás",
      "translation": "rectification / correction",
      "pos": "noun"
    },
    {
      "lemma": "sajtóper",
      "translation": "press lawsuit / defamation lawsuit",
      "pos": "noun"
    }
  ]
}
