{
  "id": "vocab.b2.22.04",
  "lesson": "b2-22-04",
  "title": "Interpreting Demographic Data Vocabulary",
  "theme": "Demographics, generations and the life course",
  "words": [
    {
      "lemma": "születésszám",
      "translation": "birth rate / number of births",
      "pos": "noun"
    },
    {
      "lemma": "termékenységi arányszám",
      "translation": "total fertility rate",
      "pos": "noun"
    },
    {
      "lemma": "korfa",
      "translation": "population pyramid / age structure",
      "pos": "noun"
    },
    {
      "lemma": "népességfogyás",
      "translation": "depopulation / population decline",
      "pos": "noun"
    },
    {
      "lemma": "eltartottsági ráta",
      "translation": "dependency ratio",
      "pos": "noun"
    }
  ]
}
