{
  "id": "vocab.c1.biroifuggetlenseg.01",
  "lesson": "c1-biroifuggetlenseg-01",
  "title": "C1 Vocabulary — The Purge & Forced Retirement of Senior Judges",
  "theme": "The Dismantling of Independent Judiciary & Rule of Law Breakdown",
  "words": [
    {
      "lemma": "kényszernyugdíjazás",
      "translation": "forced retirement of judges",
      "pos": "noun"
    },
    {
      "lemma": "bírói függetlenség",
      "translation": "judicial independence",
      "pos": "expression"
    },
    {
      "lemma": "elmozdíthatatlanság elve",
      "translation": "principle of irremovability of judges",
      "pos": "expression"
    },
    {
      "lemma": "politikai tisztogatás",
      "translation": "political purge",
      "pos": "expression"
    },
    {
      "lemma": "Európai Bíróság",
      "translation": "Court of Justice of the European Union (CJEU)",
      "pos": "expression"
    },
    {
      "lemma": "életkori diszkrimináció",
      "translation": "age discrimination",
      "pos": "expression"
    },
    {
      "lemma": "jogállami visszalépés",
      "translation": "rule of law backsliding",
      "pos": "expression"
    },
    {
      "lemma": "hatalmi ágak elválasztása",
      "translation": "separation of powers",
      "pos": "expression"
    }
  ]
}
