{
  "id": "vocab.b2.nemzetisegek.05",
  "lesson": "b2-nemzetisegek-05",
  "title": "How Nationality Self-Governments Work Today Vocabulary",
  "theme": "Hungary's 13 recognized nationalities and Jewish cultural heritage",
  "words": [
    {
      "lemma": "nemzetiségi önkormányzat",
      "translation": "nationality self-government",
      "pos": "noun"
    },
    {
      "lemma": "kulturális autonómia",
      "translation": "cultural autonomy",
      "pos": "noun"
    },
    {
      "lemma": "nemzetiségi szószóló",
      "translation": "parliamentary nationality advocate / spokesperson",
      "pos": "noun"
    },
    {
      "lemma": "anyanyelvi oktatás",
      "translation": "mother-tongue education",
      "pos": "noun"
    },
    {
      "lemma": "asszimiláció",
      "translation": "assimilation",
      "pos": "noun"
    },
    {
      "lemma": "támogatási rendszer",
      "translation": "subsidy / funding system",
      "pos": "noun"
    }
  ]
}
